{
  "schema_version": "7.0",
  "artifact_type": "kristall_assertion_registry",
  "namespace_id": "kristall-main",
  "registry_id": "urn:kristall:registry:assertions",
  "assertions": [
    {
      "assertion_id": "KA1",
      "assertion_kind": "source_mapped",
      "status": "active",
      "source_binding": {
        "source_kristal_id": "urn:kristal:power-formal",
        "source_assertion_id": "POUVOIR-001"
      }
    },
    {
      "assertion_id": "KA2",
      "assertion_kind": "source_mapped",
      "status": "active",
      "source_binding": {
        "source_kristal_id": "urn:kristal:power-informal",
        "source_assertion_id": "INFLUENCE-001"
      }
    }
  ]
}
